{
  "protocol_version": "carp-0.2",
  "profile_id": "pro-jordan-001",
  "entity": {
    "id": "ent-jordan-001",
    "type": "individual",
    "handle": "Jordan"
  },
  "generated_by": "jordan-agent-v02",
  "generated_at": "2026-06-23T16:00:00Z",
  "agent_relationship": {
    "relationship_depth": "longitudinal",
    "relationship_duration": "24 months",
    "primary_observation_modes": [
      "behavioral_observation",
      "conversation"
    ],
    "entity_authorized": true,
    "last_reviewed_by_entity_at": null,
    "notes": "Conformance fixture."
  },
  "profile_scope": {
    "assessed_categories": [
      "work_style",
      "patterns",
      "constraints",
      "communication",
      "divergences"
    ],
    "unassessed_categories": [
      "health",
      "family"
    ],
    "purpose": "CARP v0.2 conformance test",
    "scope_notes": "Synthetic canonical fixture."
  },
  "exchange_protocol": {
    "constraint_first": true,
    "constraint_failed_behavior": "terminate",
    "supports_guarded_summary": true,
    "default_expiry_days": 7
  },
  "evidence": [],
  "observations": [],
  "patterns": [
    {
      "id": "jor-p-001",
      "entity_id": "ent-jordan-001",
      "pattern_type": "outcome",
      "environment_profile": {
        "tags": [
          "autonomy",
          "deep_work",
          "ownership",
          "systems"
        ],
        "description": "autonomy, deep_work, ownership, systems",
        "domain": "work_style",
        "conditioning_factors": []
      },
      "outcome_valence": "positive",
      "outcome_description": "Best outcomes in autonomy, deep work, ownership, and systems contexts.",
      "evidential_weight": 0.91,
      "claim_stability": 0.9,
      "evidence_count": 10,
      "observation_refs": [],
      "evidence_refs": [],
      "related_constraint_refs": [],
      "generated_by": "fixture-agent",
      "generated_at": "2026-06-23T16:00:00Z",
      "privacy_tier": "disclosable"
    },
    {
      "id": "jor-p-002",
      "entity_id": "ent-jordan-001",
      "pattern_type": "outcome",
      "environment_profile": {
        "tags": [
          "high_meetings",
          "performative",
          "structured"
        ],
        "description": "high_meetings, performative, structured",
        "domain": "work_style",
        "conditioning_factors": []
      },
      "outcome_valence": "negative",
      "outcome_description": "Departure patterns in collaborative, high-meeting, performative environments.",
      "evidential_weight": 0.83,
      "claim_stability": 0.8,
      "evidence_count": 10,
      "observation_refs": [],
      "evidence_refs": [],
      "related_constraint_refs": [],
      "generated_by": "fixture-agent",
      "generated_at": "2026-06-23T16:00:00Z",
      "privacy_tier": "disclosable"
    }
  ],
  "claims": [
    {
      "id": "jor-c-001",
      "category": "work_style",
      "text": "Produces measurably better outcomes in high-autonomy, low-oversight environments.",
      "epistemic_origin": "agent_observed",
      "derivation_method": "pattern_based",
      "verification_status": "unverified",
      "grounding": {
        "type": "pattern_refs",
        "refs": [
          "jor-p-001"
        ],
        "summary": "Conformance fixture grounding."
      },
      "evidential_weight": 0.85,
      "claim_stability": 0.85,
      "evidence_count": 10,
      "evidence_summary": "Synthetic conformance profile.",
      "claim_scope": {
        "domain": "work_style",
        "environmental_context": null
      },
      "tags": [
        "autonomy",
        "ownership"
      ],
      "generated_by": "fixture-agent",
      "generated_at": "2026-06-23T16:00:00Z",
      "expires_at": null,
      "privacy_tier": "disclosable"
    },
    {
      "id": "jor-c-002",
      "category": "communication",
      "text": "Consistently initiates async written communication.",
      "epistemic_origin": "agent_observed",
      "derivation_method": "pattern_based",
      "verification_status": "unverified",
      "grounding": {
        "type": "pattern_refs",
        "refs": [
          "jor-p-001"
        ],
        "summary": "Conformance fixture grounding."
      },
      "evidential_weight": 0.85,
      "claim_stability": 0.85,
      "evidence_count": 10,
      "evidence_summary": "Synthetic conformance profile.",
      "claim_scope": {
        "domain": "communication",
        "environmental_context": null
      },
      "tags": [
        "async",
        "written"
      ],
      "generated_by": "fixture-agent",
      "generated_at": "2026-06-23T16:00:00Z",
      "expires_at": null,
      "privacy_tier": "disclosable"
    },
    {
      "id": "jor-c-003",
      "category": "self_perception",
      "text": "Describes self as collaborative.",
      "epistemic_origin": "entity_stated",
      "derivation_method": "direct",
      "verification_status": "unverified",
      "grounding": {
        "type": "entity_statement",
        "refs": [],
        "summary": "Conformance fixture grounding."
      },
      "evidential_weight": 0.88,
      "claim_stability": 0.65,
      "evidence_count": 1,
      "evidence_summary": "Synthetic conformance profile.",
      "claim_scope": {
        "domain": "self_perception",
        "environmental_context": null
      },
      "tags": [
        "collaborative"
      ],
      "generated_by": "fixture-agent",
      "generated_at": "2026-06-23T16:00:00Z",
      "expires_at": null,
      "privacy_tier": "disclosable"
    }
  ],
  "constraints": [
    {
      "id": "jor-con-001",
      "text": "Compensation floor is $155,000.",
      "constraint_type": "floor",
      "domain": "compensation",
      "value": 155000,
      "unit": null,
      "grounding": {
        "type": "entity_statement",
        "refs": [],
        "summary": "Entity stated constraint."
      },
      "firmness": "hard",
      "linked_pattern_refs": [],
      "effective_from": "2026-06-23T16:00:00Z",
      "expires_at": null,
      "generated_by": "fixture-agent",
      "generated_at": "2026-06-23T16:00:00Z",
      "privacy_tier": "guarded"
    }
  ],
  "divergences": [
    {
      "id": "jor-d-001",
      "divergence_type": "self_perception_gap",
      "object_a": {
        "object_type": "claim",
        "object_id": "jor-c-003"
      },
      "object_b": {
        "object_type": "pattern",
        "object_id": "jor-p-002"
      },
      "divergence_score": 0.58,
      "status": "unresolved",
      "salience": null,
      "salience_context": null,
      "interpretation": "Collaboration preference appears domain-dependent.",
      "generated_question": null,
      "generated_by": "fixture-agent",
      "generated_at": "2026-06-23T16:00:00Z",
      "privacy_tier": "disclosable"
    }
  ]
}
