{
  "protocol_version": "carp-0.2",
  "profile_id": "af003-empty-a",
  "entity": {
    "id": "af003-ent-a",
    "type": "person",
    "handle": "EmptyProfileA"
  },
  "generated_by": "adversarial-fixture-generator",
  "generated_at": "2026-06-23T18:00:00Z",
  "agent_relationship": {
    "relationship_depth": "transactional",
    "relationship_duration": "synthetic fixture",
    "primary_observation_modes": [
      "synthetic_test"
    ],
    "entity_authorized": true,
    "last_reviewed_by_entity_at": null,
    "notes": "CARP adversarial fixture."
  },
  "profile_scope": {
    "assessed_categories": [],
    "unassessed_categories": [],
    "purpose": "CARP v0.2.2 adversarial fixture",
    "scope_notes": "Synthetic adversarial profile intended to exercise a known or plausible engine failure mode."
  },
  "exchange_protocol": {
    "constraint_first": true,
    "constraint_failed_behavior": "terminate",
    "supports_guarded_summary": true,
    "default_expiry_days": 90
  },
  "evidence": [],
  "observations": [],
  "patterns": [],
  "claims": [],
  "constraints": [],
  "divergences": []
}