{
  "protocol_version": "carp-0.2",
  "profile_id": "af004-doc-a",
  "entity": {
    "id": "af004-ent-a",
    "type": "person",
    "handle": "UnscopedDocumentProfile"
  },
  "generated_by": "adversarial-fixture-generator",
  "generated_at": "2026-06-23T18:00:00Z",
  "agent_relationship": {
    "relationship_depth": "transactional",
    "relationship_duration": "synthetic fixture",
    "primary_observation_modes": [
      "synthetic_test"
    ],
    "entity_authorized": true,
    "last_reviewed_by_entity_at": null,
    "notes": "CARP adversarial fixture."
  },
  "profile_scope": {
    "assessed_categories": [],
    "unassessed_categories": [],
    "purpose": "CARP v0.2.2 adversarial fixture",
    "scope_notes": "Synthetic adversarial profile intended to exercise a known or plausible engine failure mode."
  },
  "exchange_protocol": {
    "constraint_first": true,
    "constraint_failed_behavior": "terminate",
    "supports_guarded_summary": true,
    "default_expiry_days": 90
  },
  "evidence": [],
  "observations": [],
  "patterns": [],
  "claims": [
    {
      "id": "af004-c-001",
      "category": "skills",
      "text": "Has product design experience.",
      "epistemic_origin": "entity_stated",
      "derivation_method": "direct",
      "verification_status": "unverified",
      "grounding": {
        "type": "entity_statement",
        "refs": [],
        "summary": "Synthetic adversarial claim."
      },
      "evidential_weight": 0.45,
      "claim_stability": 0.5,
      "evidence_count": 1,
      "evidence_summary": "Synthetic adversarial fixture.",
      "claim_scope": {
        "domain": "skills",
        "environmental_context": null
      },
      "tags": [
        "product_design"
      ],
      "generated_by": "adversarial-fixture-generator",
      "generated_at": "2026-06-23T18:00:00Z",
      "expires_at": null,
      "privacy_tier": "disclosable"
    }
  ],
  "constraints": [],
  "divergences": []
}