{
  "protocol_version": "carp-0.2",
  "profile_id": "pro-arclight-001",
  "entity": {
    "id": "ent-arclight-001",
    "type": "organization",
    "handle": "Arclight"
  },
  "generated_by": "arclight-agent-v02",
  "generated_at": "2026-06-23T16:00:00Z",
  "agent_relationship": {
    "relationship_depth": "longitudinal",
    "relationship_duration": "24 months",
    "primary_observation_modes": [
      "behavioral_observation",
      "conversation"
    ],
    "entity_authorized": true,
    "last_reviewed_by_entity_at": null,
    "notes": "Conformance fixture."
  },
  "profile_scope": {
    "assessed_categories": [
      "work_style",
      "patterns",
      "constraints",
      "communication",
      "divergences"
    ],
    "unassessed_categories": [
      "health",
      "family"
    ],
    "purpose": "CARP v0.2 conformance test",
    "scope_notes": "Synthetic canonical fixture."
  },
  "exchange_protocol": {
    "constraint_first": true,
    "constraint_failed_behavior": "terminate",
    "supports_guarded_summary": true,
    "default_expiry_days": 7
  },
  "evidence": [],
  "observations": [],
  "patterns": [
    {
      "id": "arc-p-001",
      "entity_id": "ent-arclight-001",
      "pattern_type": "outcome",
      "environment_profile": {
        "tags": [
          "autonomy",
          "async",
          "ownership"
        ],
        "description": "autonomy, async, ownership",
        "domain": "work_style",
        "conditioning_factors": []
      },
      "outcome_valence": "positive",
      "outcome_description": "Designers thrive with autonomy, async communication, and ownership.",
      "evidential_weight": 0.87,
      "claim_stability": 0.82,
      "evidence_count": 10,
      "observation_refs": [],
      "evidence_refs": [],
      "related_constraint_refs": [],
      "generated_by": "fixture-agent",
      "generated_at": "2026-06-23T16:00:00Z",
      "privacy_tier": "disclosable"
    }
  ],
  "claims": [
    {
      "id": "arc-c-001",
      "category": "design_authority",
      "text": "Design has genuine upstream authority.",
      "epistemic_origin": "agent_observed",
      "derivation_method": "pattern_based",
      "verification_status": "unverified",
      "grounding": {
        "type": "pattern_refs",
        "refs": [
          "arc-p-001"
        ],
        "summary": "Conformance fixture grounding."
      },
      "evidential_weight": 0.85,
      "claim_stability": 0.85,
      "evidence_count": 10,
      "evidence_summary": "Synthetic conformance profile.",
      "claim_scope": {
        "domain": "design_authority",
        "environmental_context": null
      },
      "tags": [
        "ownership",
        "upstream_design"
      ],
      "generated_by": "fixture-agent",
      "generated_at": "2026-06-23T16:00:00Z",
      "expires_at": null,
      "privacy_tier": "disclosable"
    },
    {
      "id": "arc-c-002",
      "category": "communication",
      "text": "Written-first async culture.",
      "epistemic_origin": "agent_observed",
      "derivation_method": "pattern_based",
      "verification_status": "unverified",
      "grounding": {
        "type": "pattern_refs",
        "refs": [
          "arc-p-001"
        ],
        "summary": "Conformance fixture grounding."
      },
      "evidential_weight": 0.85,
      "claim_stability": 0.85,
      "evidence_count": 10,
      "evidence_summary": "Synthetic conformance profile.",
      "claim_scope": {
        "domain": "communication",
        "environmental_context": null
      },
      "tags": [
        "async",
        "written"
      ],
      "generated_by": "fixture-agent",
      "generated_at": "2026-06-23T16:00:00Z",
      "expires_at": null,
      "privacy_tier": "disclosable"
    }
  ],
  "constraints": [
    {
      "id": "arc-con-001",
      "text": "Approved compensation band ceiling is $205,000.",
      "constraint_type": "ceiling",
      "domain": "compensation",
      "value": 205000,
      "unit": null,
      "grounding": {
        "type": "entity_statement",
        "refs": [],
        "summary": "Entity stated constraint."
      },
      "firmness": "hard",
      "linked_pattern_refs": [],
      "effective_from": "2026-06-23T16:00:00Z",
      "expires_at": null,
      "generated_by": "fixture-agent",
      "generated_at": "2026-06-23T16:00:00Z",
      "privacy_tier": "guarded"
    },
    {
      "id": "arc-con-002",
      "text": "Role includes recurring board/customer presentations.",
      "constraint_type": "requirement",
      "domain": "presentation",
      "value": true,
      "unit": null,
      "grounding": {
        "type": "entity_statement",
        "refs": [],
        "summary": "Entity stated constraint."
      },
      "firmness": "soft",
      "linked_pattern_refs": [],
      "effective_from": "2026-06-23T16:00:00Z",
      "expires_at": null,
      "generated_by": "fixture-agent",
      "generated_at": "2026-06-23T16:00:00Z",
      "privacy_tier": "guarded"
    }
  ],
  "divergences": []
}
