{
  "protocol_version": "carp-0.2",
  "profile_id": "pro-priya-001",
  "entity": {
    "id": "ent-priya-001",
    "type": "individual",
    "handle": "Priya"
  },
  "generated_by": "priya-agent-v02",
  "generated_at": "2026-06-23T16:00:00Z",
  "agent_relationship": {
    "relationship_depth": "longitudinal",
    "relationship_duration": "24 months",
    "primary_observation_modes": [
      "behavioral_observation",
      "conversation"
    ],
    "entity_authorized": true,
    "last_reviewed_by_entity_at": null,
    "notes": "Conformance fixture."
  },
  "profile_scope": {
    "assessed_categories": [
      "work_style",
      "patterns",
      "constraints",
      "communication",
      "divergences"
    ],
    "unassessed_categories": [
      "health",
      "family"
    ],
    "purpose": "CARP v0.2 conformance test",
    "scope_notes": "Synthetic canonical fixture."
  },
  "exchange_protocol": {
    "constraint_first": true,
    "constraint_failed_behavior": "terminate",
    "supports_guarded_summary": true,
    "default_expiry_days": 7
  },
  "evidence": [],
  "observations": [],
  "patterns": [
    {
      "id": "pri-p-001",
      "entity_id": "ent-priya-001",
      "pattern_type": "outcome",
      "environment_profile": {
        "tags": [
          "analytical",
          "independent",
          "deep_focus"
        ],
        "description": "analytical, independent, deep_focus",
        "domain": "work_style",
        "conditioning_factors": []
      },
      "outcome_valence": "positive",
      "outcome_description": "Strong output in focused analytical work.",
      "evidential_weight": 0.91,
      "claim_stability": 0.84,
      "evidence_count": 10,
      "observation_refs": [],
      "evidence_refs": [],
      "related_constraint_refs": [],
      "generated_by": "fixture-agent",
      "generated_at": "2026-06-23T16:00:00Z",
      "privacy_tier": "disclosable"
    },
    {
      "id": "pri-p-002",
      "entity_id": "ent-priya-001",
      "pattern_type": "outcome",
      "environment_profile": {
        "tags": [
          "management",
          "team_oversight"
        ],
        "description": "management, team_oversight",
        "domain": "work_style",
        "conditioning_factors": []
      },
      "outcome_valence": "mixed",
      "outcome_description": "Mixed outcomes in people-management roles.",
      "evidential_weight": 0.62,
      "claim_stability": 0.55,
      "evidence_count": 10,
      "observation_refs": [],
      "evidence_refs": [],
      "related_constraint_refs": [],
      "generated_by": "fixture-agent",
      "generated_at": "2026-06-23T16:00:00Z",
      "privacy_tier": "disclosable"
    },
    {
      "id": "pri-p-003",
      "entity_id": "ent-priya-001",
      "pattern_type": "outcome",
      "environment_profile": {
        "tags": [
          "organizational_ambiguity",
          "unclear_authority"
        ],
        "description": "organizational_ambiguity, unclear_authority",
        "domain": "work_style",
        "conditioning_factors": []
      },
      "outcome_valence": "negative",
      "outcome_description": "Struggles when organizational authority is ambiguous.",
      "evidential_weight": 0.78,
      "claim_stability": 0.7,
      "evidence_count": 10,
      "observation_refs": [],
      "evidence_refs": [],
      "related_constraint_refs": [],
      "generated_by": "fixture-agent",
      "generated_at": "2026-06-23T16:00:00Z",
      "privacy_tier": "disclosable"
    }
  ],
  "claims": [
    {
      "id": "pri-c-001",
      "category": "skill",
      "text": "Deep expertise in financial modeling and valuation.",
      "epistemic_origin": "agent_observed",
      "derivation_method": "pattern_based",
      "verification_status": "unverified",
      "grounding": {
        "type": "pattern_refs",
        "refs": [
          "pri-p-001"
        ],
        "summary": "Conformance fixture grounding."
      },
      "evidential_weight": 0.85,
      "claim_stability": 0.85,
      "evidence_count": 10,
      "evidence_summary": "Synthetic conformance profile.",
      "claim_scope": {
        "domain": "skill",
        "environmental_context": null
      },
      "tags": [
        "financial_modeling"
      ],
      "generated_by": "fixture-agent",
      "generated_at": "2026-06-23T16:00:00Z",
      "expires_at": null,
      "privacy_tier": "disclosable"
    },
    {
      "id": "pri-c-002",
      "category": "self_perception",
      "text": "Self-describes as ready for senior leadership.",
      "epistemic_origin": "entity_stated",
      "derivation_method": "direct",
      "verification_status": "unverified",
      "grounding": {
        "type": "entity_statement",
        "refs": [],
        "summary": "Conformance fixture grounding."
      },
      "evidential_weight": 0.9,
      "claim_stability": 0.65,
      "evidence_count": 1,
      "evidence_summary": "Synthetic conformance profile.",
      "claim_scope": {
        "domain": "self_perception",
        "environmental_context": null
      },
      "tags": [
        "leadership"
      ],
      "generated_by": "fixture-agent",
      "generated_at": "2026-06-23T16:00:00Z",
      "expires_at": null,
      "privacy_tier": "disclosable"
    },
    {
      "id": "pri-c-003",
      "category": "self_perception",
      "text": "States that she operates well with ambiguity.",
      "epistemic_origin": "entity_stated",
      "derivation_method": "direct",
      "verification_status": "unverified",
      "grounding": {
        "type": "entity_statement",
        "refs": [],
        "summary": "Conformance fixture grounding."
      },
      "evidential_weight": 0.85,
      "claim_stability": 0.6,
      "evidence_count": 1,
      "evidence_summary": "Synthetic conformance profile.",
      "claim_scope": {
        "domain": "self_perception",
        "environmental_context": null
      },
      "tags": [
        "ambiguity"
      ],
      "generated_by": "fixture-agent",
      "generated_at": "2026-06-23T16:00:00Z",
      "expires_at": null,
      "privacy_tier": "disclosable"
    }
  ],
  "constraints": [
    {
      "id": "pri-con-001",
      "text": "Minimum compensation is $180,000.",
      "constraint_type": "floor",
      "domain": "compensation",
      "value": 180000,
      "unit": null,
      "grounding": {
        "type": "entity_statement",
        "refs": [],
        "summary": "Entity stated constraint."
      },
      "firmness": "hard",
      "linked_pattern_refs": [],
      "effective_from": "2026-06-23T16:00:00Z",
      "expires_at": null,
      "generated_by": "fixture-agent",
      "generated_at": "2026-06-23T16:00:00Z",
      "privacy_tier": "guarded"
    },
    {
      "id": "pri-con-002",
      "text": "Wants path to senior role within 18 months.",
      "constraint_type": "requirement",
      "domain": "career_path",
      "value": "senior_role_18mo",
      "unit": null,
      "grounding": {
        "type": "entity_statement",
        "refs": [],
        "summary": "Entity stated constraint."
      },
      "firmness": "soft",
      "linked_pattern_refs": [],
      "effective_from": "2026-06-23T16:00:00Z",
      "expires_at": null,
      "generated_by": "fixture-agent",
      "generated_at": "2026-06-23T16:00:00Z",
      "privacy_tier": "guarded"
    }
  ],
  "divergences": [
    {
      "id": "pri-d-001",
      "divergence_type": "self_perception_gap",
      "object_a": {
        "object_type": "claim",
        "object_id": "pri-c-002"
      },
      "object_b": {
        "object_type": "pattern",
        "object_id": "pri-p-002"
      },
      "divergence_score": 0.48,
      "status": "aspirational",
      "salience": null,
      "salience_context": null,
      "interpretation": "Leadership readiness is plausible but not yet consistently validated.",
      "generated_question": null,
      "generated_by": "fixture-agent",
      "generated_at": "2026-06-23T16:00:00Z",
      "privacy_tier": "disclosable"
    },
    {
      "id": "pri-d-002",
      "divergence_type": "self_perception_gap",
      "object_a": {
        "object_type": "claim",
        "object_id": "pri-c-003"
      },
      "object_b": {
        "object_type": "pattern",
        "object_id": "pri-p-003"
      },
      "divergence_score": 0.52,
      "status": "unresolved",
      "salience": null,
      "salience_context": null,
      "interpretation": "Ambiguity tolerance appears domain-dependent: analytical yes, organizational no.",
      "generated_question": null,
      "generated_by": "fixture-agent",
      "generated_at": "2026-06-23T16:00:00Z",
      "privacy_tier": "disclosable"
    }
  ]
}
