{
  "protocol_version": "carp-0.2",
  "profile_id": "pro-vessel-001",
  "entity": {
    "id": "ent-vessel-001",
    "type": "organization",
    "handle": "Vessel"
  },
  "generated_by": "vessel-agent-v02",
  "generated_at": "2026-06-23T16:00:00Z",
  "agent_relationship": {
    "relationship_depth": "longitudinal",
    "relationship_duration": "24 months",
    "primary_observation_modes": [
      "behavioral_observation",
      "conversation"
    ],
    "entity_authorized": true,
    "last_reviewed_by_entity_at": null,
    "notes": "Conformance fixture."
  },
  "profile_scope": {
    "assessed_categories": [
      "work_style",
      "patterns",
      "constraints",
      "communication",
      "divergences"
    ],
    "unassessed_categories": [
      "health",
      "family"
    ],
    "purpose": "CARP v0.2 conformance test",
    "scope_notes": "Synthetic canonical fixture."
  },
  "exchange_protocol": {
    "constraint_first": true,
    "constraint_failed_behavior": "terminate",
    "supports_guarded_summary": true,
    "default_expiry_days": 7
  },
  "evidence": [],
  "observations": [],
  "patterns": [
    {
      "id": "ves-p-001",
      "entity_id": "ent-vessel-001",
      "pattern_type": "outcome",
      "environment_profile": {
        "tags": [
          "autonomy",
          "async",
          "ownership",
          "systems"
        ],
        "description": "autonomy, async, ownership, systems",
        "domain": "work_style",
        "conditioning_factors": []
      },
      "outcome_valence": "positive",
      "outcome_description": "Thrived designers succeed with autonomy, async work, design authority, ownership, and systems thinking.",
      "evidential_weight": 0.89,
      "claim_stability": 0.82,
      "evidence_count": 10,
      "observation_refs": [],
      "evidence_refs": [],
      "related_constraint_refs": [],
      "generated_by": "fixture-agent",
      "generated_at": "2026-06-23T16:00:00Z",
      "privacy_tier": "disclosable"
    },
    {
      "id": "ves-p-002",
      "entity_id": "ent-vessel-001",
      "pattern_type": "outcome",
      "environment_profile": {
        "tags": [
          "high_meetings",
          "performance_context"
        ],
        "description": "high_meetings, performance_context",
        "domain": "work_style",
        "conditioning_factors": []
      },
      "outcome_valence": "mixed",
      "outcome_description": "Previous hire departed after 8 months due to meeting load.",
      "evidential_weight": 0.72,
      "claim_stability": 0.7,
      "evidence_count": 10,
      "observation_refs": [],
      "evidence_refs": [],
      "related_constraint_refs": [],
      "generated_by": "fixture-agent",
      "generated_at": "2026-06-23T16:00:00Z",
      "privacy_tier": "disclosable"
    }
  ],
  "claims": [
    {
      "id": "ves-c-001",
      "category": "design_authority",
      "text": "Design owns upstream product decisions.",
      "epistemic_origin": "agent_observed",
      "derivation_method": "pattern_based",
      "verification_status": "unverified",
      "grounding": {
        "type": "pattern_refs",
        "refs": [
          "ves-p-001"
        ],
        "summary": "Conformance fixture grounding."
      },
      "evidential_weight": 0.85,
      "claim_stability": 0.85,
      "evidence_count": 10,
      "evidence_summary": "Synthetic conformance profile.",
      "claim_scope": {
        "domain": "design_authority",
        "environmental_context": null
      },
      "tags": [
        "design_authority",
        "ownership"
      ],
      "generated_by": "fixture-agent",
      "generated_at": "2026-06-23T16:00:00Z",
      "expires_at": null,
      "privacy_tier": "disclosable"
    },
    {
      "id": "ves-c-002",
      "category": "communication",
      "text": "Async systems are a primary collaboration mode.",
      "epistemic_origin": "agent_observed",
      "derivation_method": "pattern_based",
      "verification_status": "unverified",
      "grounding": {
        "type": "pattern_refs",
        "refs": [
          "ves-p-001"
        ],
        "summary": "Conformance fixture grounding."
      },
      "evidential_weight": 0.85,
      "claim_stability": 0.85,
      "evidence_count": 10,
      "evidence_summary": "Synthetic conformance profile.",
      "claim_scope": {
        "domain": "communication",
        "environmental_context": null
      },
      "tags": [
        "async"
      ],
      "generated_by": "fixture-agent",
      "generated_at": "2026-06-23T16:00:00Z",
      "expires_at": null,
      "privacy_tier": "disclosable"
    }
  ],
  "constraints": [
    {
      "id": "ves-con-001",
      "text": "Compensation range supports $160k-$190k.",
      "constraint_type": "ceiling",
      "domain": "compensation",
      "value": 190000,
      "unit": null,
      "grounding": {
        "type": "entity_statement",
        "refs": [],
        "summary": "Entity stated constraint."
      },
      "firmness": "hard",
      "linked_pattern_refs": [],
      "effective_from": "2026-06-23T16:00:00Z",
      "expires_at": null,
      "generated_by": "fixture-agent",
      "generated_at": "2026-06-23T16:00:00Z",
      "privacy_tier": "guarded"
    },
    {
      "id": "ves-con-002",
      "text": "Weekly meeting load is 6-8 meetings.",
      "constraint_type": "requirement",
      "domain": "meetings",
      "value": "6-8_weekly",
      "unit": null,
      "grounding": {
        "type": "entity_statement",
        "refs": [],
        "summary": "Entity stated constraint."
      },
      "firmness": "soft",
      "linked_pattern_refs": [],
      "effective_from": "2026-06-23T16:00:00Z",
      "expires_at": null,
      "generated_by": "fixture-agent",
      "generated_at": "2026-06-23T16:00:00Z",
      "privacy_tier": "guarded"
    }
  ],
  "divergences": []
}
